{
  "schema_version": "1.0", "profile_id": "generic_tpu", "display_name": "Generic TPU", "material_family": "TPU", "manufacturer": null,
  "compatible_process_types": ["FDM", "CUSTOM"], "source_classification": "CONSERVATIVE_HEURISTIC", "source_references": [], "confidence": "LOW",
  "nozzle_range_mm": [0.3, 1.0], "layer_height_range_mm": [0.1, 0.4], "wall_thickness_multiplier": 1.2, "thin_feature_multiplier": 1.25,
  "bridge_risk_modifier": 1.3, "overhang_risk_modifier": 1.2, "support_removal_risk": "HIGH", "warping_risk": "LOW",
  "brittleness_risk": "LOW", "adhesion_risk": "MEDIUM", "dimensional_change_guidance": "Review flexibility, feed path, dimensional response, and measured compensation for the actual hardness and formulation.",
  "temperature_information": null, "user_editable_fields": ["nozzle_range_mm", "layer_height_range_mm", "wall_thickness_multiplier", "thin_feature_multiplier", "bridge_risk_modifier", "overhang_risk_modifier"],
  "notes": ["Conservative generic heuristic; not manufacturer-specific."], "limitations": ["Hardness, elasticity, feeding, and support removal are not simulated."],
  "created_at": "2026-08-05T00:00:00Z", "updated_at": "2026-08-05T00:00:00Z"
}
