{
  "schema_version": "1.0", "profile_id": "custom_material", "display_name": "Custom Material", "material_family": "CUSTOM", "manufacturer": null,
  "compatible_process_types": ["FDM", "RESIN", "CUSTOM"], "source_classification": "USER_CONFIGURABLE", "source_references": [], "confidence": "UNKNOWN",
  "nozzle_range_mm": [0.01, 2.0], "layer_height_range_mm": [0.01, 1.0], "wall_thickness_multiplier": 1.0, "thin_feature_multiplier": 1.0,
  "bridge_risk_modifier": 1.0, "overhang_risk_modifier": 1.0, "support_removal_risk": "UNKNOWN", "warping_risk": "UNKNOWN",
  "brittleness_risk": "UNKNOWN", "adhesion_risk": "UNKNOWN", "dimensional_change_guidance": "User-supplied guidance; verify against the actual material and process.",
  "temperature_information": null, "user_editable_fields": ["display_name", "material_family", "manufacturer", "compatible_process_types", "nozzle_range_mm", "layer_height_range_mm", "wall_thickness_multiplier", "thin_feature_multiplier", "bridge_risk_modifier", "overhang_risk_modifier", "support_removal_risk", "warping_risk", "brittleness_risk", "adhesion_risk", "dimensional_change_guidance", "temperature_information", "notes", "limitations"],
  "notes": ["All behavior values are user-supplied."], "limitations": ["Chroma3D has not validated custom material values."],
  "created_at": "2026-08-05T00:00:00Z", "updated_at": "2026-08-05T00:00:00Z"
}
